[
  {
    "prompt_id": "gp-2026-07-09-glasshouse-grid-001",
    "run_id": "2026-07-netflix-teaser-title-slam-001",
    "answer_id": "raycast-bridge-grid-001",
    "slot_type": "shot_grid",
    "prompt_text": "THE GLASS HOUSE — one 16:9 cinematic image containing a clean 3x3 semantic storyboard/contact-sheet grid, 9 rectangular film-frame panels arranged in a 3 by 3 layout, no captions, no labels, no frame numbers, no readable UI, no watermark. Current prestige streaming supernatural thriller proof-of-concept, premium Netflix-style title-slam energy without copying any existing show. One coherent directorial intention: a glass-walled modernist mansion in humid Miami becomes a transparent trap, where reflections reveal a family secret before reality fractures. Visual language: black-glass architecture, tropical storm pressure, wet limestone, neon pool light, moonlit palms, lightning reflected in floor-to-ceiling windows, anamorphic lenses, ARRI Alexa grain, crushed blacks, cyan moonlight, amber interior practicals, subtle crimson warning accents, high-end ominous thriller grade. Panel beats: 1) wide eerie location beat, glass mansion glowing under storm clouds beside black water and palms; 2) empty pool deck with one champagne glass trembling, ripples moving against the wind; 3) human reaction beat, adult woman in silk eveningwear staring at her reflection in a glass wall, but the reflection looks terrified and half a second out of sync; 4) macro symbolic clue, a hairline crack spreading through a family portrait behind glass; 5) hallway of mirrored glass panes, multiple reflections of the same adult man appearing at different ages; 6) impact/action beat, a sliding glass wall slams shut by itself as lightning hits and silhouettes scatter; 7) overhead security-camera-like view of guests frozen around a dining table, each reflected twice in impossible positions; 8) symbolic supernatural reveal, red palm smear appearing on the inside of pristine glass while no one stands there, restrained not gory; 9) final title-card image, the mansion seen through fractured glass with elegant large centered chrome serif title text THE GLASS HOUSE, subtle title-slam impact, black negative space, premium ominous finish. Make it feel like a polished sizzle-board for a current youthful but adult thriller series: beautiful wealthy people, secrets, betrayal, Miami storm-night luxury, what-did-I-miss cold-open tension.",
    "model": "nano_banana_2",
    "provider": "nano_banana_pro",
    "created_at": "2026-07-09T22:18:50Z",
    "source": "generated",
    "artifact_ids": [
      "artifact-grid-v1",
      "artifact-grid-002"
    ],
    "notes": "Cinematic 3x3 image grid prompt generated from THE GLASS HOUSE brief using the raycast-pro-bridge generate_cinematic_grid contract; executed with Higgsfield CLI due MCP token failure in active session. Produced v1 (1376x768 letter draft) then v2 (2752x1536 clean 2k, Higgsfield job dba80933) which became the Seedance start image."
  },
  {
    "prompt_id": "gp-2026-07-09-glasshouse-video-001",
    "run_id": "2026-07-netflix-teaser-title-slam-001",
    "answer_id": "seedance-2.0-001",
    "slot_type": "video_result",
    "prompt_text": "The supplied start image is the generated 3x3 THE GLASS HOUSE cinematic storyboard grid reference; preserve the glass-mansion world, storm-night Miami atmosphere, reflective architecture, fractured-glass motif, wealthy adult thriller tone, and final title-slam identity. Create a 12-second Seedance 2.0 image-to-video premium streaming teaser in 16:9. Shot 1, 0-3s: begin on the glass mansion in the storm, slow dolly toward glowing windows as rain crawls across the glass and thunder rolls low. Shot 2, 3-6s: match-cut inside to the adult woman facing her reflection; her real face holds still while the reflection turns a half-beat late, cyan moonlight and amber practicals flickering. Shot 3, 6-9s: a hairline crack races across the family portrait, the sliding glass wall slams shut, and the red palm smear blooms on pristine glass; one sharp camera jolt on the impact, no gore. Shot 4, 9-12s: hard cut to black-glass mansion seen through fractured reflections, elegant chrome serif title THE GLASS HOUSE slams centered on a bass hit, rain and distant thunder decay into silence. One main camera move per shot, readable cuts, anamorphic thriller grade, no extra logos, no subtitles, no watermark.",
    "model": "seedance_2_0",
    "provider": "seedance",
    "created_at": "2026-07-09T23:08:23Z",
    "source": "generated",
    "artifact_ids": [
      "artifact-video-001"
    ],
    "notes": "Seedance 2.0 I2V prompt. Start image = artifact-grid-002 (media/grid-3x3-001.png). Billable generation approved by Gordo; Higgsfield job cf74f3a8-62c4-4dd6-83ca-f65b811ea56a."
  }
]