[
  {
    "prompt_id": "pink-room-sora-2",
    "run_id": "2026-07-pink-room-two-part-teaser-001",
    "answer_id": "pink-room-teaser-answer",
    "slot_type": "video_result",
    "prompt_text": "Create a 12-second teaser for THE PINK ROOM. Savage-cut montage of Colombian nightlife, Guaracha house culture, and a hidden pink-lit underworld ruled by a mysterious female boss, with a clean college kid pulled in too deep. Dirty-glamour underground documentary-thriller: sweaty clubs, rain, motorbikes, motel corridors, anxious faces, wealth beside danger. Fast 0.4-0.8 second cuts, warped Guaracha bass, flash frames, sudden silence, hard THE PINK ROOM title slam, blackout. Premium but raw realism, social pressure and consequences, no captions or logos.",
    "model": "sora-2",
    "provider": "sora",
    "created_at": "2026-07-10T06:15:00Z",
    "source": "generated",
    "artifact_ids": [
      "artifact-pink-room-sora-2-pending"
    ],
    "notes": "Prompt filed only. Stage only — do not run paid generation yet."
  },
  {
    "prompt_id": "pink-room-seedance-2",
    "run_id": "2026-07-pink-room-two-part-teaser-001",
    "answer_id": "pink-room-teaser-answer",
    "slot_type": "video_result",
    "prompt_text": "Create a 12-second, 16:9 teaser for THE PINK ROOM. Savage-cut montage of an innocent college driver entering a pink-lit underground Guaracha nightlife circuit controlled by a calm female boss. Rainy streets, club energy, motel corridors, motorbikes, security, frightened faces, dirty glamour. Handheld documentary urgency, fluorescent pink practicals, wet asphalt, restrained 35mm grain. Fast cuts over distorted bass, sudden silence, hard THE PINK ROOM title slam and blackout. Keep the lead and boss consistent; no subtitles or logos.",
    "model": "seedance-2.0",
    "provider": "seedance",
    "created_at": "2026-07-10T06:15:00Z",
    "source": "generated",
    "artifact_ids": [
      "artifact-pink-room-seedance-2-pending"
    ],
    "notes": "Prompt filed only. Stage only — do not run paid generation yet."
  }
]
